"MSA","Counties","Wage Index","GAF"
"8760","Vineland-Millville-Bridgeton, NJ Cumberland, NJ","1.1788","1.1192"
"8780","2 Visalia-Tulare-Porterville, CA Tulare, CA","1.0262","1.0179"
"8800","Waco, TX McLennan, TX","0.8172","0.8709"
"8840","1 Washington, DC-MD-VA-WV District of Columbia, DC Calvert, MD Charles, MD Frederick, MD Montgomery, MD Prince Georges, MD Alexandria City, VA Arlington, VA Clarke, VA Culpeper, VA Fairfax, VA Fairfax City, VA Falls Church City, VA Fauquier, VA Fredericksburg City, VA King George, VA Loudoun, VA Manassas City, VA Manassas Park City, VA Prince William, VA Spotsylvania, VA Stafford, VA Warren, VA Berkeley, WV Jefferson, WV","1.0969","1.0654"
"8920","Waterloo-Cedar Falls, IA Black Hawk, IA","0.8629","0.9040"
"8940","Wausau, WI Marathon, WI","1.0101","1.0069"
"8960","1 West Palm Beach-Boca Raton, FL Palm Beach, FL","1.0348","1.0237"
"9000","2 Wheeling, WV-OH (WV Hospitals) Belmont, OH Marshall, WV Ohio, WV","0.8099","0.8656"
"9000","2 Wheeling, WV-OH (OH Hospitals) Belmont, OH Marshall, WV Ohio, WV","0.8759","0.9133"
"9040","Wichita, KS Butler, KS Harvey, KS Sedgwick, KS","0.9499","0.9654"
"9080","Wichita Falls, TX Archer, TX Wichita, TX","0.8428","0.8895"
"9140","Williamsport, PA Lycoming, PA","0.8476","0.8929"
"9160","Wilmington-Newark, DE-MD New Castle, DE Cecil, MD","1.1172","1.0788"
"9200","Wilmington, NC New Hanover, NC Brunswick, NC","0.9225","0.9463"
"9260","Yakima, WA Yakima, WA","1.0317","1.0216"
"9270","2 Yolo, CA Yolo, CA","1.0262","1.0179"
"9280","York, PA York, PA","0.9152","0.9411"
"9320","Youngstown-Warren, OH Columbiana, OH Mahoning, OH Trumbull, OH","0.9516","0.9666"
"9340","Yuba City, CA Sutter, CA Yuba, CA","1.0381","1.0259"
"9360","2 Yuma, AZ Yuma, AZ 1 Large Urban Area 2 Hospitals geographically located in the area ar e assigned the statewide FY 2005. New Jersey and Rhode Island rural floors are imputed as discussed in section IV.N.6 of the preamble.","0.9148","0.9408","rural","wage","index","for"